{
  "schemaVersion": "scanner-ticker-v1",
  "ticker": "BMHS",
  "name": "PT Bundamedik Tbk",
  "sector": "Kesehatan",
  "industry": "Medical Care Facilities",
  "des": {
    "eligible": true,
    "universe": "OJK KEP-21/D.04/2026 — DES Periode I 2026 (21 Mei 2026)",
    "asOf": "2026-05-21"
  },
  "scanner": {
    "state": "RESEARCH_CONFIRMED",
    "stateLabel": "Terkonfirmasi Riset",
    "stateChangedDate": "2026-10-03"
  },
  "researchLens": [
    "UNDERVALUED"
  ],
  "evidenceStrength": {
    "overall": "ADEQUATE",
    "quality": "NOT_AVAILABLE",
    "valuation": "SUPPORTIVE",
    "price": "NOT_AVAILABLE",
    "catalyst": "NOT_AVAILABLE"
  },
  "whyWatching": [
    {
      "code": "VALUATION_OPPORTUNITY",
      "text": "Valuasi menunjukkan ruang yang layak diteliti lebih lanjut."
    }
  ],
  "whatToVerify": [
    {
      "code": "CATALYST_UNAVAILABLE",
      "text": "Evidence catalyst belum tersedia secara memadai."
    }
  ],
  "freshness": {
    "overall": "CURRENT",
    "valuation": "CURRENT",
    "fundamentals": "UNAVAILABLE",
    "price": "UNAVAILABLE",
    "catalyst": "SOURCE_UNAVAILABLE",
    "lastEvaluatedAt": "2026-10-03T14:45:00.000Z"
  },
  "valuationContext": {
    "status": "SIAP",
    "evidence": "STRONG"
  },
  "provenance": {
    "valuation": "CANONICAL_FAIR_VALUE",
    "price": "MARKET_DATA",
    "des": "OJK_DES",
    "catalyst": "PUBLIC_MATERIAL_EVENTS"
  },
  "actions": {
    "primary": {
      "type": "FAIR_VALUE",
      "label": "Cek Fair Value",
      "url": "/fair-value/?ticker=BMHS"
    },
    "secondary": {
      "type": "QSTP",
      "label": "Buka QSTP",
      "url": "/qstp.html?ticker=BMHS"
    }
  },
  "stateHistory": [
    {
      "state": "RESEARCH_CONFIRMED",
      "date": "2026-10-03",
      "reason": "VALUATION_OPPORTUNITY"
    }
  ]
}
